{"$schema":"https://json-schema.org/draft/2020-12/schema","type":"object","required":["schema_version","generated_at","total_count","versions"],"properties":{"schema_version":{"const":"1.0"},"generated_at":{"type":"string"},"total_count":{"type":"integer"},"versions":{"type":"array","items":{"type":"object","required":["app_id","version_name","version_code","permissions","components","flags"],"properties":{"app_id":{"type":"string"},"version_name":{"type":"string"},"version_code":{"type":"integer"},"permissions":{"type":"object"},"components":{"type":"object"},"flags":{"type":"object"}}}}}}
